삼십팔 아가미 메감지.	0
솔직히 나는 그런 거 생각 못 해주고 그냥 나도 장거리 연애 반대	1
약간 옆에 있어줘야 되는 그런 느낌 옆에 있어야지 나도 어느 정도 이렇게 마음을 알고 그러지	1
장거리 연애하는데 뭐 맨날 카톡이랑 뭐 전화만 영상통화만 하면서 어떻게 사랑을 해. {laughing}	1
그러면 너는 남자친구 생기면은 왜 그런 애들 있잖아.	1
남자친구 여자친구 생기면 주변에 친구 다 인제 안 보는 애들 오로지 서로만 보는 애들 그런 애들 있잖아	1
어떻게 생각해 너는?	1
아 나 솔직히 내가 만약 연애를 하면 난 그런 타입일 것 같거든	1
왜냐하면 약간 좀 나도 진짜 막 -미쳐- 미쳐버리는 타입인데	1
근데 난 그거는 내가 좀 안 좋다고 생각해.	1
왜냐하면 주변을 어느 정도 무시하고 그런 하는 사랑은 그것도 나쁘고	1
약간 좀 사랑을 무시하고 우정만 챙기는 것도 그것도 나쁘다고 생각해.	1
그냥 어느 정도 적절한 밸런스가 있어야 된다고 생각하는 타입	1
아 사랑을 무시하고 우정 그거 진짜 인정이야 그것도 솔직히 말하면 그러면 연애를 할 필요가 없지.	1
지 친구들이랑만 계속 놀면 되지 뭐단디 연애를 하냐.	1
그런 생각이 들게 하는 사람들이 되게 많은 것 같기는 해.	1
아 그치 근데 연애 같은 거 하면서 뭐 다른 사람들이 그러잖아 너는 사랑이야 우정이야 약간 그런데	1
난 솔직히 사랑에 가까운 타입인데 솔직히 두 개 다 중요하지 않고 아 두 개 다 중요하니까	1
-사랑- 진짜 사랑에만 미치는 것도 우정에만 미치는 것도 그것도 나쁜 거라 생각해 어느 정도 진짜	1
아까 말했듯이 균형 맞춰가지고 하는 게 좋다고 생각해.	1
근데 요즘은 연애하려고 소개팅 어플 이런 거 진짜 많이 나오잖아 막 아만다 이런 거	1
근데 난 솔직히 그런 거 보면 약간 거부감 들거든 왜냐면 생판 모르는 사람인데	1
뭐 얼굴 점수 보고 그런 거 하니까 근데 그거 되게 잘 애용하는 사람도 많더라?	1
아 진짜 난 그거 전혀 그냥 뭐 인스 아 뭐 맨날 유튜브 광고에만 그렇게 떠가지고	1
아 난 왜 저런 거 하지 약간 이 생각 들어 굳이 좀 그렇게까지 막 사람을 찾아야 되나?	1
난 약간 좀 자연스러운 만남을 추구하는 사람이라서 그런 거 약간 반대 입장이야.	1
근데 되게 신기한 게 거기서 만나서 망한 사람도 있는데	1
거기서 만나서 되게 잘 만난 되게 예쁘게 만나는 사람들도 난 그래서 그거 보고 되게 의외였어	1
어 신기하다 저런 소개팅 어플에서 만나서 되게 이쁘게 잘 만날 수 있구나 약간 편견이다 생각했어 나도	1
와 진짜 근데 나는 전혀 못 들은 얘기라서 근데 진짜 신기하긴 하다.	1
왜냐하면 나 같은 경우에는 좀 낯을 가리니까	1
이렇게 진짜 어떻게 처음 보는 사람한테 약간 이 사람이 어떤 사람인지도 제대로 모르는데?	1
내가 이렇게 다가가서 하는 게 좀 어려워서 소개팅 어플은 평생 쓰진 않을 거 같아.	1
그럼 넌 연애에서 외모가 어느 정도 중요하다 생각해?	1
어 구십 퍼센트가 된다고 생각해.	1
왜냐면 나 약간 좀 진짜로 진짜 솔직히 말해서 아까 말했듯이	1
외모에서 갑자기 정이 떨어져 버리면 약간 좀 나는 그냥 마음이 식어버리는 타입이라서	1
난 외적인 것도 외적인 거 매우 중요하다고 생각하지 너는 어때?	1
나는 솔직히 말해서 외모는 별로 중요하진 않는 것 같애.	1
왜냐면 한 번 인제 그 사람을 좋아하게 되면	1
뭐 어떤 표정을 짓든 귀여워 보이고 예뻐 보이니까 그런 것도 있기도 하고	1
되게 오래 연애를 해본 결과 제일 중요한 건 나랑 맞는 성격이다.	1
외모도 어느 정도 있기는 하겠지 그래도 한 무시할 수는 없는 것 같애.	1
구십 퍼센트까지는 아니어도 한 이십 퍼센트 삼십 퍼센트?	1
그 정도 솔직히 아 그니까 왜냐면 취향이라는 게 있잖아.	1
잘생긴 거 말고 쟤 얼굴이 내 취향이냐 그거에 따라서 화가 났을 때도 얼굴을 보면 화가 풀릴 수도 있고 그러니까	1
구십 퍼센트까지 아니어도 어느 정도는 자기 취향에 맞는 사람을 만나야 괜찮지 않을까?	1
아 그치 솔직히 뭐 사람에 있어서 외모 외적인 부분을 빼놓을 순 없지.	1
그 솔직히 남자친구 여자친구 막 잘생기고 예쁘면 좋잖아?	1
그러니까 그래도 외적인 것도 중요하지.	1
맞아 근데 또 연애를 하믄서 느낀 게 우리가 학생이니까 돈이 진짜	1
돈이 진짜 또 하나의 뭐라 해야 될까 큰 산 넘어야 될 큰 산인 것 같애.	1
요즘은 데이트를 할려면 어쩔 수 없이 드는 게 돈이니까	1
무슨 데이트를 하던지 우선 나오는 거부터 다 돈이야 걸어 나오지 않는 이상	1
그러니까 와 진짜 이게 연애하면서 돈 문제로 많이 싸운다는 게 틀린 말이 아니구나 되게 많이 느꼈어.	1
아 나도 얼마 전에 나도 진짜 오래 사귄 애한테 얘기를 해봤어.	1
왜냐면 걔가 진짜 계속 알바 -해- 해가지고 솔직히 나 같으면은	1
계속 알바하면은 수중에 한 천만 원 정도는 남아있겠다 약간 이 -생- -이- 이렇게 물어봤거든?	1
근데 걔는 연애해보면 안다고 연애할 때 돈 엄청 많이 든다고 그런 그래가지고	1
와 진짜 연애할 때 돈 엄청 많이 드는구나 약간 이 생각 해.	1
혼자 나가도 돈 많이 드는데 연애하면 얼마나 돈 많이 들겠어 그렇구나라고 생각했지.	1
그래서 약간 나는 남자친구랑 얘기할 때 기념일	1
이거를 딱 일 년까지 챙기고 안 챙기 -거- 거든?	1
왜냐면 한 번 기념일 챙기면 솔직히 돈 한 이십만 원 십오만 원에서 이십만 원까지 드는 것 같애.	1
그런 거 한 번씩 하고 나면 현타 와가지고 돈 문제를 무시할 수는 없으니까	1
돈 문제를 해결하기 위해선 어느 정도 합의랑 어느 정도의 포기가 좀 필요해 연애를 계속 이어나가려면	1
맞아 연애하면서 데이트 비용 같은 것도 많이 들고 그러니까 진짜 연애할 때 약간 좀 그런 게 더 있을 것 같애.	1
근데 거기에서 추가해가지고 인제 맨날 그 사람 만나기 전에 꾸미고 나가야 되니까	1
약간 좀 그런 것도 돈 들고 그래가지고 그것도 나름대로 고충일 것 같아.	1
그럼 넌 남자친구랑 남자친구한테 쌩얼 틀 수 있어?	1
아 난 못 틀 것 같은데?	1
아 진짜로?	1
어 왜냐면 나 약간 좀 연애를 하면서 약간 좀 약간 좀 그런 거 같아.	1
완벽한 내 모습을 보여주고 싶다 약간 그런 게 있는 거 같아 나는	1
진짜 그러면은 매번 준비 풀로 착 짠 이렇게 해가지고 나갈 수 있어?	1
아 그렇게는 힘들 수도 있겠지만 최대한 그렇게 하고 나가야 되잖 나갈 것 같아 나는	1
그러면 너가 집에 가만히 있는데 남자친구가 집 앞으로 찾아왔어.	1
막 아 자기 얼굴 보고 싶어서 뭐 자기 아프다니까 이거 챙겨주러 갈게 잠깐 얼굴만 보고 갈게.	1
근데 너가 완전히 쌩얼이야 그럼 어떡할 거야.	1
아 나 진짜 그런 거 진짜 싫을 거 같아 그러면 그러고 아 뭐 진짜	1
아 좀만 기달리라하고 진짜 한 이십 분만 기달리라고하고 하지 않을까?	1
뭐 엄청 열심히 준비해가지고 가지 않을까?	1
그냥 약간 좀 나는 진짜 -완벽하- 완벽한 상태에서 연애를 해야 된다 약간 이런 입장이라서	1
그럼 뭐 한 이 년 삼 년 지나가면 보여줄 수 있어?	1
아 그치 그 정도면 볼 수 있지 그러면 뭐 털어놓은 입장이 되는데 이 년 삼 년 사귈까?	1
그러면 결혼은 어떻게 할 거야 이 년 삼 년 안 사귀고 결혼할 거야?	1
응 나는 빨리 연애하고 아 쪼끔 연애하고 결혼할 거야.	1
왜?	1
아 근데 막 많이 연애해도 결국 결혼 안 한 사람들 -보니- 보니까	1
굳이 연애하는데 약간 좀 나도 솔직히 진짜 엄청나게 많은 선입견을 갖고 있던 사람이라서	1
막 뭐 홍현희 제이슨 커플만 봐도 일 개월 만나고 결혼했다고 하는데	1
난 솔직히 이해를 못 했었거든?	1
근데 요즘 느낀 건 그냥 굳이 연애하는데 기간 딱히 필요 없고	1
마음맞는 사람만 있으면 이 사람 결혼 -할- 하겠다 싶으면 결혼하자 약간 이 생각 들어.	1
음 그럴 수도 있긴 하겠다.	1
나는 회사랑 학교에 대해서 얘기해보고 싶어.	1
아 학교 다닐 때 뭐~	1
우리 진짜 재밌는 것도 많았는데 제일 기억에 남는 거 있으면 한 번 말해보자	1
학교 다닐 때 제일 기억에 남는 건 아무래도 기숙사 아닐까?	1
기숙사에서 삼 년이나 있기도 했었고	1
솔직히 말해서 기숙사 애들끼리 할 수 있는 재밌는 게 되게 많았으니까 그런게 재밌긴 했지	1
학교 다닐 때 기숙사가 제일 기억에 많이 남는 것 같애 넌?	1
아 난 약간 학교 다닐 때 하면서 제일 기억에 남았던 거 하면은	1
없 없 없나 없는 것 같은데 {laughing} 아니 근데 다 매순간이 솔직히 다 기억에 남아가지고	1
뭐 동아리 했을 때도 그렇고 뭐 학생회 했을 때도 그렇고	1
뭐 우리 나 기숙사 있을 때도 그랬었고 다 재밌었던 것 같아 그냥 했을 때	1
근데 진짜 중학교 때랑 고등학교 때랑 중학교 때는 이제 여중을 다니고 고등학교 때는 공학을 다녔으니까	1
분위기가 완전히 다른 것 같아 진짜	1
아예 그냥 뭐랄까 그 느낌이 틀려 공학이랑 그냥 한 성별만 있는 학교는	1
그지 않아?	1
아 그치 나도 좀 처음엔 진짜 적응 많이 못 했었는데	1
그냥 좀 뭔가 다른 거 같아 결이 다르다 약간?	1
근데 나는 솔직히 말해서 여중 쪽이 좀 더 잘 맞았던 것 같아 우리 정명 다녔을 때	1
근데 고등학교 때도 솔직히 재밌긴 했어 재밌는 게 너무 많았어.	1
우선 선생님들 수업 시간 딱 되기 전에 매점 빨리 튀어가 가지고	1
딱 먹을 거 가꼬 와서 라면 국물은 밖에다 놔두고 수업 끝나면 먹고 오든가	1
아니면 화장실 간다 해놓고 라면 국물 먹기 그런 거 진짜 재밌었어.	1
아 진짜 근데 진짜 막 그런 것도 있었고	1
막 활동 같은 것도 난 진짜 재밌는 것도 많았어.	1
그냥 뭐 우리 수행평가 막 해도 솔직히 그때는 진짜 힘들었거든	1
근데 지금 생각해보면 진짜 재미있는 것도 많았고	1
뭐 소논문 소논문 발표대회?	1
그런 거 있어도 솔직히 그런 게 많이 지금 대학교 와가지고	1
간단한 과제 같은 거 리포트 써도 그런 게 나름 도움 도움 됐다고 생각해	1
참고문헌 이런 거 막 하는 거 보니까	1
맞아 솔직히 그런 게 많이 도움 되기는 해	1
근데 고등학교 시절이 제일 재밌다는 말이 왜 그 말이 나왔는지 알 거 같아.	1
솔직히 그때가 제일 재밌었어 진짜로.	1
근데 선생님들은 물론 힘들게 하는 선생님이 있었지	1
근데 되게 좋은 선생님들도 많았으니까	1
돌아가라면 다시 돌아가고 싶을 정도로 되게 재밌었던 것 같애.	1
맞아 진짜로	1
사람들 이제 선생님들도 만나면서 선생님들이	1
물론 별로인 선생님들도 있었지만 그래도 나는 진짜 완전 좋았었거든?	1
나는 중학교 때 막 별로 선생님들이랑 별로 안 친하다 보니까 고등학교 와서 이제 많이 친해져 가지고	1
그것도 나름 괜찮았었고	1
그래가지고 그것도 있는데	1
나는 진짜 애들이랑 이렇게 하는 것도 재미있었어 뭐 하는 거	1
근데 기숙사는 재밌었던 이유가 우리 학교 기숙사가 쪼끔 프리한 면도 있긴 해서 재밌었던 것도 있는데	1
우선 막 되게 매일매일이 수련회랑 수학여행 온 느낌? {laughing}	1
막 밤늦게까지 애들이랑 같이 있으니까 그게 되게 재밌었어 나는	1
그리고 되게 유대감이 엄청 생기는 거 같애 다같이 힘든 거	1
막 막 말하고 서로 막 위로해 주고 그런 거 그런 게 되게 좋았어 나는	1
아 진짜 확실히 나도 뭐 나 일 년 한 일 년도 안 돼서 {laughing} 맨날 왔다 갔다 기숙사 나갔다 들어갔다 하긴 했는데	1
나도 기숙사 -들어가- 들어가 있을 때 나름 재밌었어.	1
막 시험 기간 시험 하루 전에 치킨 시켜 먹어가지고	1
막 삼 학년 선배들이 막 {laughing} 쟤네 돼지라고 하면서 그런 적도 있었고 것도 재밌었고	1
걍 기숙사 있었을 때 막 시험 보고 있는데	1
시험 하나 마지막 날 전에 뭐 우리 다 비 내리는데 치킨 한 마리 먹으러 간다고 {laughing}	1
어디였지 저기 뒷개 뒷개였나 거기까지 걸어가고 그것도 재밌었고	1
맞아 그 진짜 이때 이 지금 와서 생각해 보면 별의 별 짓을 다 한 거 같기는 해	1
진짜 선생님들 하지 말라는 것도 제일 많이 하고 암튼 되게 재밌었어.	1
근데 제일 좋았던 건 나 우리 학교에 매점 있는 거 진짜 좋았어.	1
매점에 먹을 거 맛있는 거 진짜 많아가지고	1
맞아 매점 진짜로 나는 솔직히 매점 잘 가는 편은 아니었는데	1
나는 그냥 매점에선 별로 안 사 먹고 약간 거기서 약간	1
{laughing} 애들 거 뺏어먹고 {laughing} 그런 타입이었는데	1
매점 진짜 뭐 체육수업하기 전에 가 가지고 라면 하나 먹으면서 인제 걸어가면서 먹고	1
그랬던 게 진짜 재밌었던 거 같애.	1
근데 우리 학교 욕 진짜 많이 했는데 아 좋긴 좋았던 거 같애.	1
되게 재밌는 것도 많고 슨생님들도 좋고	1
아 진짜 그 머리 희끗희끗한 그 선생님	1
그 고삼 때 우릴 너무 괴롭힌 그 선생님은 진짜 나는 아직까지도 그 선생님은 얘기만 해도 막 막 짜증나 죽겠어.	1
아 {laughing} 나는 그 선생님 진짜 충격적이였던 게	1
진짜 우리 자소서 쓸 때도 그 선생님이 봐줬잖아.	1
그냥 진짜 아 나는 저렇게 늙지 말아야 되겠다 라고 생각했었어.	1
진짜 너무 힘들게 하긴 했지 우리를 근데 고삼 때 생각해 보면 되게 유대감이 많았던 거 같애.	1
애들하고 다 같이	1
아 약간 뭐 수능 준비하는 애들이나 아니면 수시 자소서 준비하는 애들이나 다 힘든 건 마찬가지였으니까	1
그래서 약간 서로서로 뭔가	1
고 일 고 이 때는 진짜 되게 많이 싸웠던 애들이 꼴도 보기 싫어했던 애들인데	1
뭔가 약간 다 같이 힘든 느낌 다 같이 약간 고통을 공유하는 느낌이야.	1
아 맞아 근데 진짜 고 삼 되면서 확실히 애들이 좀 많이 달라졌다.	1
난 좀 깜짝 놀란 게 진짜 애들이 다 공부하더라 그래서 그것도 좀 깜짝 놀랐고	1
근데 고 삼 때가 난 진짜로 공부 안 했고 진짜로 막 제일 놀러 다녔던 시기?	1
약간 그랬던 거 같아.	1
진짜 고 이때는 좀 나 쉬는 시간까지 진짜 열심히 공부했었는데	1
고 삼 때 되면서 맨날 놀고 그랬던 거 같아.	1
맞아 근데 고등학교 때 진짜 그~	1
뭔가 일 학년 때는 남녀가 분반이 돼 있으니까 서로서로 약간 눈치 보는 느낌?	1
막 학교에 화장도 엄청 하고 오고 여자애들은 남자애들도 괜히 막 이쪽 ((x)) 한 번 더 오고 그랬잖아.	1
근데 남녀 합반되고 나서는 진짜 나는 아 남녀공학에 대한 그런 환상이 다 깨졌어.	1
이런 거구나 이런 게 남녀공학이구나 라고 확 느꼈어.	1
나는 그냥 좀	1
다 재밌었던 거 같아 진짜 남녀공학이든 남녀 분반이든 진짜 애들도	1
진짜 엄청 웃긴 애들도 많아 가지고	1
막 진짜 일 학년 때만 해도 진짜 막 우리 수학여행 갔을 때도	1
막 진짜 재밌었어.	1
나는 그냥 뭐 순간 어느 순간을 {laughing} 말할 수 없을 만큼 그냥 다 재밌게 살았던 거 같아.	1
우리 수학여행을 어디로 갔지 고등학교 때?	1
서울로 갔지 않아?	1
서울로 갔었나?	1
아 서울로 갔었구나.	1
근데 수학여행 다니면 확실히 좀 재밌긴 했었어.	1
그런 게 여행 한 번 가는 게 애들이랑 다 같이	1
너 나 할 거 없이 엄청나게 꾸미고 와가지고 근데 어차피 봤을 땐 다 애기들이잖아.	1
애기들이 그렇게 꾸미고 와가지고 노니까 재밌긴 재밌었지 진짜	1
맞어 진짜 가 가지고 진짜 수학여행 가서 인제	1
막 엄청 설레는 그 기분을 아직도 잊을 수 없을 만큼 {laughing}	1
그냥 그런 거 하나하나 다 갔을 때 재밌고 그랬던 거 같아.	1
근데 진짜 나는 뭔가 고등학교 애들을	1
고등학교 졸업하면은 이렇게까지 많이 못 보게 될 줄 몰랐는데	1
아 되게 그 고등학교 그 학교라는 그 집단 안에서 같이 있다는 게	1
되게 자주 볼 수 있고 같이 뭔가 얘기할 수 있는 그런 기회가 그때야 많이 생기는 거지	1
졸업하고 나서는 억지로 이제 뭐 약속을 잡지 않는 이상	1
별로 친하지 않는 애들은 그냥 소식도 모르고 살게 되는 경우가 진짜 많구나 나 그거 되게 느꼈어.	1
아 진짜 그거 나도 동감하는 게 지금만 해서도 진짜 맨날 만나는 애들	1
걍 맨날 친했던 애들만 만나지 진짜 진짜 뭐	1
그냥 별로 안 친했던 안 친했는데 그래도 얘기는 하는 그런 애들은 뭐 소식도 진짜 모르고 살고	1
그냥 뭐 일부러 이렇게 약속을 잡지 않는 이상	1
더 이상 만날 일 없구나 약간 이 생각 많이 들었지	1
맞아 근데 그 생각 들면 약간 아련해지더라 아~ 고등학교 때가 {laughing} 좋긴 좋았구나 다 같이 그렇게 있을 때가	1
근데 그렇게 같이 있으면서 쓸데없이 싸우는 것도 진짜 많았던 거 같아.	1
우리 진짜 별에 별 사건 다 있었잖아.	1
아 진짜 왜 굳이 그런 그 순간에서 그냥 좀만 참으면 되는데	1
약간 왜 싸웠지 약간 이 생각 많이 들기도 하고	1
그냥 내가 좀만 더 인제 너그럽게 이렇게 배려해 줬으면은	1
그것만 지나면 괜찮았을 텐데 약간 이 생각 많이 들기도 했어.	1
근데 너 그거였잖아 공포의 선도부장이었잖아. {laughing}	1
{laughing} 아니야 나 진짜 나 지금 솔직히 말해서 지금 와서 제일 후회하는 게 선도부장한 거 진짜 후회해	1
왜냐면 그때 욕 많이 먹기도 진짜 많이 먹었고 {laughing}	1
그냥 솔직히 말해서 내 어린 나이에 감당할 수 있는 직책이 아니었던 것 같아.	1
아 근데 진짜 웃기긴 했어 우리 학년이든 일 학년이든 삼 학년이든	1
너 앞에 스면은 아무도 안 갔잖아 밥 먹으러 화장한 애들이고 교복 줄인 애들이고 {laughing}	1
아 그리고 내가 이번에 느낀 게 나 진짜 진짜 애들한테 너무 미안했던 게	1
일 학년 애들이랑 그런 애들한테 너무 미안했던 게	1
내가 이번에 가 가지고 적응교육을 받았잖아.	1
인제 거기에 적응 교육 받았는데 훈련하고 그랬잖아.	1
밥 먹는데도 막 얼차려 하고 있고 밥 먹기 전에 얼차려 하고 그랬단 말이야.	1
그래서 나는 솔직히 진짜 밥 엄청 맛있었는데 거기 밥	1
그래서 하루에 한 끼 밖에 안 먹고 그랬었는데	1
아 나 진짜 나쁜 사람이었구나 생각 들었어. {laughing}	1
막상 내가 겪고 나니까 약간 진짜	1
고등학교 때 고등학교 때 너가 그 잡았던 애들한테 미안했어?	1
그냥 좀 좀만 더 약간 좀 선도부장 해도 약간 좀 눈 좀 처음에는 진짜	1
아 내가 이 학교 진짜 복장 같은 게 맘에 안 드니까	1
그냥 다 바꿔보겠다라는 생각으로 가긴 했는데	1
그냥 나중에 와서 느낀 게 아 굳이 이렇게까지 복장을 막 잡고 굳이 이렇게 막 화장을 잡고 할 필요가 있나?	1
어차피 이런 것도 하나의 자유를 억압하는 게 아닌가 약간 이 생각도 많이 들었어 나중에 와서	1
근데 약간 난 지금 와서 후회하는 게 교복 많이 안 입은 거 진짜 후회해.	1
아 그때 아니면 입을 일도 없었는데 뭐 어쩐다고 그렇게 계속 맨날 교복 안 입는다고 뻐팅겼지?	1
교복 좀 자주 입을 걸 이런 생각 그때 아니면 진짜 못 입는 거잖아 교복은	1
아 진짜 나는 근데 교복 좀 많이 입고 다니긴 했는데 교복	1
교복 진짜 약간 좀 길 지나가다가 우리가 한 그래도 한 오후 네 시 다섯 시쯤 되면은 그때쯤 마트를 간다	1
그러면은 막 사람들 중학생들이랑 고등학생들 인제	1
자 다 인제 끝나고 수업 끝나고 오는 거 교복 입고 오는 거 보면서	1
약간 좀 아련해지는 느낌 그런 게 있지	1
그러고 나는 아 기숙사 살 때 사감쌤들진짜 욕 많이 했는데	1
진짜 그 사감쌤들은 우리가 치는 그 사고들을 정말 정말 천사처럼 다 봐주신 거구나 하는 생각을 했다?	1
진짜 더럽게 말 안 들었잖아 우리	1
맨날 밤에 새벽마다 수다 떨면서 떠들고 와가지고 문 쾅쾅쾅 뚜드리면은 다 자는 척하고 이불 속에 숨고	1
아 이제 와서 생각해 보면 사감쌤들을 진짜 우리가 힘들게 했다 그런 생각 했어.	1
{laughing} 진짜	1
거기서 맨날 뭐 에어컨 몰래 애들이 에어컨 냉장고 선에다가 연결시켜놓고 에어컨 틀고 몰래	1
그런 거 보면서 {laughing} 진짜 진짜 기숙사 때 나는 솔직히	1
이 삼 학년 때는 기숙사에 없어서 몰랐지만 난 일 학년 땐 기숙사에 있을 때 진짜 재밌었어.	1
뭐 새벽에 공부한다고 하는데 고 밑으로 내려가서	1
그 핸드폰 질 하고 있고 {laughing}	1
맞아 근데 난 제일 재밌었던 건 일 학년 기숙사다 끝나갈 때	1
((학x))쌤이랑 고기파티 한 거	1
거기 이 층 기숙사 다 비우고 하룻밤 자고 그게 진짜 재밌었던 거 같애.	1
이제 와서 생각해 보면 솔직히 고등학교 기숙사에서 그런 걸 한다는 거 자체가 말이 안 되지	1
근데 선생님들이 그렇게 해준 게 진짜 기억에 되게 많이 남아.	1
그 고기 꾸어 먹고 애들이랑 막 다같이 모여가지고 카드 게임하고 진짜 재밌었어 그때는	1
아 난 사실 못 갔어. {laughing}	1
너 못 왔어 못 왔나?	1
어 그때 막 가기 귀찮아가지고 인제 막상 집 갔는데 가기 가기 귀찮아서 계속 버팅겼는데	1
{laughing} 갈 걸 그랬어 그 나중에도 후회했어.	1
진짜 그 며칠 안 지나서도 애들이 막 엄청 재밌었다고 그러니까	1
진짜 기숙사에 있을 때 막 애들한테 애들한테	1
막 진짜 막 음식도 뺏어 먹고 아침 급식 먹으러 갈 때 다 부어가지고 인제 {laughing}	1
일어나가지고 진짜 밥 먹는 사람 한두 명 되고 나중에 와서는	1
그런 것도 재밌었고 이제 저녁에 석식 먹고 들어왔을 때	1
막 시험 기간에도 시험기간 때 공부 하나도 안 하고	1
막 마지막 날 돼서야 겨우 이거 외워야 된다고 하면서 서로 알려주면서 이제 그렇게 하고	1
그런 것도 진짜 재밌었고	1
걍 다 애들도 진짜 막	1
진짜 막 갑자기 뭐 저녁에 갑자기 뭐 갑자기 자기들끼리 화장하고 자기들끼리 혼자 춤추면서 그것도 웃겼고	1
다 재밌었던 거 같아.	1
근데 나는 이제 와서 약간 웃긴 게	1
우리는 왜 그렇게 축제와 체육대회에 집착을 하였는가	1
그게 이제 와서 생각해보면 되게 웃기다 그지 않아?	1
아 진짜 축제 때 막 진짜 왜 그렇게 진짜 다 집착을 했지?	1
굳이 그 가운데 자리가 뭐가 중요하다고 막 –선- 선배 돼 가지고	1
막 그런 것도 있었고	1
뭐 체육대회만 해도 내가 왜 그렇게 열심히 했는지 모르겠어.	1
그냥 조용히 뒤에서 뒤에서 있을 걸 귀찮은데 {laughing}	1
진짜 축제 때 막 누가 반 애들끼리 다 같이 춤 짜가지고 막 겁나 열심히 하고	1
이제 와서 생각해보면 우리가 무슨 아이돌도 아니고 그렇게 할 필요도 없었는데	1
다 춤에 집착해가지고 막 하루에 여섯 시간씩 수업 시간 다 빼고 연습실 빌려가지고 막 연습하고	1
그런 거 보면 진짜 웃긴 거 같애 체육대회도 막	1
선생님들한테 선생님 체육대회잖아요 다음 시간 체육대회잖아요 이러면서	1
수업 시간 한 시간 빼가지고 운동장 가서 막 연습하고 그랬던	1
이제 와서 보면 진짜 웃겼던 거 같애 그건 진짜	1
특히 우리 중학생 때 더 그랬던 거 같아 막 에어로빅한다고 하면서	1
근데 나는 그때 항상 의아했던 게 왜 에어로빅보다	1
달리기가 더 점수가 더 큰데 {laughing} 에어로빅에 왜케 집착하지 약간 이런 생각도 했는데	1
근데 또 애들이 나름대로의 자존심이 있더라고	1
중학교 때 생각해도 진짜 웃겼었어.	1
