삼십팔 아가미 메감지.	0
그~ 딱 중간 지점까지 만나서 같이 뛰어온다던지 그릏게서 바통 터치하고 집까지 다시 뛰어 간다던지	3
이런 식으로 운동하면은 친구랑 같이 운동을 하면은 나는 훨씬 더 좋을 것 같다고 생각 혀.	3
왜냐면 아침에 진짜 엄청 뛰어 가지고 운동하고 집으로 오고 씻고 하면은	3
진짜 정말 상쾌하게 하루를 보낸 시작하는 스타트인 거 같아 가지고	3
너랑 같이 운동을 한 번 해보는 것도 괜찮은 거 같어.	3
나는 당장이라도 실천해야 될 거 같은 욕구가 뿜뿜하고 있슈.	3
우리 딱 마침 중간에 태미 공원이 있으니까 아침에 만나서 뗘 보는 건 어뗘?	3
진짜 이거 ((진짜)) 정말 좋은 생각인 거 같애.	3
그래 가주고 내일 아침에 진짜 한 여덟 시 늦어도 여덟 시에 일어나 가주고	3
너무 늦은가?	3
여덟 시에 일어나 가주구 어~ 태미 공원까지 만나 가주구	3
뭐~ 뛰던지 산책이라도 하면은 좋은 거니까 몸을 움직여야 돼.	3
그러니까 우리 내일부터 태미 공원에서 만나 가주구 한 번 해 보자구	3
그리구 나는 너가 운동하기 전에 꼭 했으면 하는 게 나는 진짜 스트레칭을 하고 뛰는 걸 (())	3
스트레칭을 -하- 하고 뛰는 거를 추천 혀.	3
왜냐면은 스트레칭을 안 하고 진짜 일어나자마자 뛴 경험이 내가 있단 말여.	3
내가 학교를 빨리 가야 하는 상황인디 내가 학교 수험표를 받으러 갔어야 했는디	3
그걸 늦어 가지고 선생님의 전화를 받자마자 학교까지 전력 질주를 했단 말여.	3
근데 이렇게 하고 내가 그 뒤로 이 삼 일을 진짜 고생했어.	3
왜냐면은 몸이 {laughing} 알이 지대로 배겨 가주고 진짜 몸을 못 움직이겠는 거여.	3
그래 가주고 운동을 하기 전에 진짜 스트레칭을 해 가지고 자느라 진짜	3
근육도 같이 자고 있으니까 그~ 몸을 좀 깨워 주는 것도 일종의 운동이라고 생각하기 때문에	3
뛰기 전에 꼭 스트레칭을 하고 뛰는 거를 추천 혀.	3
아니 나도 그걸 겪어본 적이 있는 게 내가 작년 시험 시험 날에 밤을 새고 씻고서	3
아~ 학교 가기 나가기 전에 너무 시간이 많이 남았으니까 쫌 누워볼까 했는데 한 시간을 자버린 ((거))	3
여덟 아~ 일곱 시 오십오 분에 일어난 거야.	3
학교까지는 십오 분이 걸리는데 그~ 성 그~ 그래 가주고 그름 여덟 시까지 가야 되는데	3
아~ 그래 가주구 선 그~ 딱 마지노선이 여덟 시 십 분이었기 때문에	3
진짜 (()) 진짜 일어나자마자 바로 뛰쳐나가 가주구 어~ 그~ 언덕을 진짜 뛰어 올라간 적 있는디	3
그때 그~ 시험 볼 때 진짜 집중이 {laughing} 안 ((되가)) 너무 숨이 차 가주구 집중이 안 되는 거여.	3
그래서 진짜 아~(()) 뭐~ 쪼끔만 더 일찍 깼어도 뭐~ 준비하고 뗬을 수 있은 있었는데	3
그래 가주구 이제 아~ 진짜 밤은 새지 말고 미리미리 공부해야 겠다 라는 교훈을 ((얻었)) 적이 적이 있어.	3
(()) 진짜 우리가 밤을 새면 안되는 이유가 우리가 이제 우리가	3
지금부터 앞으로 매일 매일 이렇게 평화롭게 하루를 보낼 수 없잖어.	3
언젠가는 우리의 생활 리듬을 아침엔 일어나고 밤에는 자야 하는 그런 생활 리듬을 맞춰야 하잖어.	3
그래 가주구 그렇게 급작스럽게 바꾸면은 분명 힘들 테니까 슬슬 바꿔야 한다고 생각 혀.	3
그래야 대학교 가서도 과제도 성실하게 할 수 있고 미루지 않구	3
그리고 그르고 또 ((우리가지금)) 밤 늦게 매일 자잖어.	3
그럴 때 내가 추천 하는 게 핸드폰 할거면 차라리 불을 켜고 핸드폰 하는 걸 정말 추천 혀.	3
안 그러면은 진짜 그~ 어두운데 그~ 핸드폰 하나에 집중하다 보면은 그~ 눈이 진짜	3
안 좋게 때 안 좋아질 것 같기 때문에	3
불을 키고 차라리 핸드폰 하는 걸 추천 하구	3
그리구 까먹고 불 켜고 자는 ((거x)) 진짜 추천하지 않어.	3
그~ 눈이 우리가 잘 때 쉬잖아.	3
하루종일 떠져 있는 게 눈인데 그렇다 보니까	3
밤에 자는 데도 어둡지 않은 곳에서 자면은 눈이 진짜 안 좋더 안 ((좋다x)) 내가 기사를 봤단 말여.	3
그래서 불 키고 핸드폰 하더라도	3
잘 때만 (()) 불을 끄구 눈에 편안한 느낌을 줄 수 있는 환경을 만들어 져서 자는 걸 추천 혀.	3
아~ 그게 진짜 안 좋았다니 안 ((좋았다니)) 진짜 몰랐어.	3
그래 가주구 내가 열한 시에 잘려고 노력을 해 가주구 불을 꺼서 이렇게 딱 했는데	3
아니 잠이 계속 안 와 가주구 새벽 여섯 시까지 불 끄고서 핸드폰 한 적이 진짜 많거든	3
그래 가주구 이제 앞으로라 앞으로는 뭐~ 불을 끄 갑자기 잠들면은	3
불을 못 끄니까 약간 우리집에 약간 시간을 조절할 수 있는 그런	3
스탠드 같은 게 (()) 시간 조절을 할 수 있으니까 그거를 약간 어둡게라도 약간	3
어둡게 켜놔 가주구 이제 밤에 절대 눈 나뻐지지 않게 쫌 해야겠어 나두	3
우리도 이제 앞자리 수가 바뀌지만 사람들은 이제 젊을 때다 이제 시작이다 라고 하겠지만은	3
그래도 우리도 진짜 더이상 늦지않게 나는 뭐든지 빨리 하는 게 좋다고 생각하기 때문에	3
어떻게든 진짜 젊었을 때 해야 된다고 생각 혀.	3
왜냐 우리는 지금 진짜 시간이 많이 남을 때잖어.	3
-그- 그러니까 지금부터라도 건강 관리를 해야 한다고 생각 혀.	3
그래야지 나중에 나중에 나한테 진짜 도움이 될 것 같은 거 같어.	3
그럼 우리 진짜 이제 시간을 내서 진짜 죽어라 진짜 패턴을 바꿔보자.	3
나 내가 요즘 해보고 싶은 게 있는디 그~ 유투브에 본 건데	3
미라클 모닝이라는 그~ 책이 있는디 그 책이 약간 새벽 다섯 시에	3
심장이 가장 뼐리 뗘 가주구	3
그때 혀 그때 활동을 하는 게 가장 도움이 된다는 거야.	3
그래서 그걸 보고서 음~ 새벽 다섯 시 어떻게 일어나지 했는데 그 사람이 열 한 시에 자고 딱 다섯 시에 일어나는디	3
진짜 하루를 알차게 사는 거여.	3
와 그 사람이 통역 하시는 분인디 진짜 무슨	3
하루 진짜 유노윤호보다 더 유노윤호처럼 (()) 유노윤호라는 말을 쓰면 안 되고	3
그 사람 이름을 써야 될 정도로 진짜 하루를 알차게 사시는 거여.	3
아침에 일어나자마자 독서하고 막 일기 쓰고 운동 하고 밥 먹고 공부 하고	3
진짜 다섯 시에 일어나니까 하루가 거의 사십팔 시간 마냥 활용 할 수 있더라고?	3
그래서 내가 진짜 지금 시간이 많을때 ((차피)) 다섯 시에 일어나서 넷플릭스 보면 되는데	3
((그냥)) 다섯 시에 일어나 볼까 라는 생각을 요즘 하고 있어.	3
니가 말한 그 분을 지금 얘기를 들어보니까 너무 동경스러워.	3
왜냐면은 나는 지금 하루에 열두 시간씩 자고 있기 때문에 내 하루는 열두 시간이 전부여.	3
근데 그 안에 밥 먹고 핸드폰 하는 게 또 전부니까	3
난 진짜 하루 하루를 진짜 허투루 보내고 있단 말이여.	3
그래서 지금 얼마 이천이십 년도 얼마 남지 않았으니까	3
우리 이천이십 년 동안 진짜 다사다난한 일이 너무 많았잖어.	3
그러니까 어띃게든 지금 ((진짜)) 그~ 끽해봐야 이 주 정도 남았지만	3
이 주라도 진짜 알차게 보내고 싶은 생각이 드는 거여.	3
그래서 나도 진짜 일찍 쫌 일어나고 새벽 다섯 시가 아니더라도 일어나서 오히려	3
진짜 너 말대로 할 수 있다면 새벽 다섯 시에 일어나서 영화를 본 다음에 해가 뜨면은	3
그때 너랑 이제 운동을 시작하고 그르구 밥 먹고 졸리면 그~ 또 자면 되니까	3
새벽 다섯 시에 일어나 보는 경험을 한 번 해보고 싶다는 생각이 들어.	3
왜냐면 지금 나와는 정말 정반대의 삶을 살고 계시는 분이 계시니까	3
나도 한 번 해봐도 괜찮을 것 같다고 생각해.	3
하루라도 그릏게 알찬 삶을 살 수 있다면 난 진짜 정말 뿌듯할 거 같아서	3
그 다음 날도 그 다음 날도 그릏게 (()) 할 수 있다는 원동력을 받을 거 같어.	3
우리가 물론 백오십 살까지 산다고들 하지만 그래도 우리 지금 시간이 너무 아깝잖아.	3
난 요즘따라 시간이 나이 먹는 게 너무 아깝드라구	3
그르구 우리가 스무 살이 돼 가주구 아~ 쫌 두렵기도 하고 그런 마음이 있잖어?	3
그니까 우리 이제 진짜 남은 얼마 안 남은 십 대에 마지막을	3
진짜 열심히 살았다 라고 생각할 수 있게 한 번 도전해 보자.	3
우리가 습관을 개선해 가주고 이제 앞으로 남은 삶들을 더 알차게 살 수 있는 거잖어?	3
그러니까 우리 음~ 아~ 쫌 힘들겠는디 아~ 쫌 못 하겠는디 이런 생각 하지 말구 어~	3
진짜 쪼금이라 이릏게 쪼금씩 줄여 나가면 되는 거잖어.	3
내가 울 물론 오늘 열 시에 일어났지만 내일은 아홉 시 내일은 여덟 시 내일은 일곱 시 이렇게 해서 천천히 줄여 나가서	3
우리가 다섯 시에 일어나면은 그게 아주 좋은 삶이라고 할 수 있지 않을까?	3
이제는 나도 진짜 다섯 시에 자는 게 아니라 다섯 시 일어나는 사람으로 한 번 바꿔보고 싶다는 생각을 혀.	3
솔직히 다섯 시에 자는 것도 그 사람들한테는 어려운 일이잖어.	3
그러니까 우리도 다섯 시에 일어나는 경험을 한 번 해보는 것도 괜찮을 것 같다고 생각 혀.	3
항상 늦게 나는 항상 거의 해 뜰 때 자는데 이제	3
열한 시에 자는 일도 한 번씩 하다 보면은 분명 사람은 적응의 동물이다 보니께	3
분명 할 수 있을 거라고 생각이 들어 조금만 노력 한다면	3
((그래x)) 나는 진짜 나는 솔직히 말하면은 이번 년도 진짜 허투루 보낸 시간이	3
지금까지도 허투루 보내고 있었단 말여.	3
그래서 그래서 진짜 너무 진짜 얼마 안 남았지만 알차게 보내는 경험을 봐도 진짜 뜻깊은 경험일 것 같어.	3
내가 어디서 들었는데 그~ 사람이 삼십 일만 해도 그게 습관이 된다는 거여.	3
그르고 우리가 졸 우리가 입학할 때 내가 들었던 것 중에 그~ {laughing} 교장 선생님이	3
아~ 삼 년이라는 시간 동안 {laughing} 알차게 알차게 보내 보라고	3
그 삼 년이라는 시간이 뭐~ 이릏게 날짜로 환산 하므 요롷게 요롷게 어쩌고 저쩌고 하셨는데 내가 그걸 듣고	3
아~ 삼 년 동안 할 수 있는 게 (()) 많구나.	3
라고 생각을 했는데 우리는 쫌 알차게 보내지 못 했잖어?	3
그러니까 우리 앞으로 그~ 이제 날 우리 뭐~	3
여태까지 그릏게 알차게 살아오지 않았더라도	3
이제 알차게 살아오면 되는 알차게 살면 되는 거니까 앞으로 우리 한 번 해 보자구	3
나도 진짜 게으르지 않고 성실한 삶을 보내고 싶어.	3
왜냐면 내가 정말 후회 하는 게 내가 건강 관리도 정말 안 했고	3
다이어트도 하겠다는 말만 해놨지 (()) 제대로 실천한 적은 한 번도 없고 제대로 성공한 적도 한 번도 없기 때문에	3
진짜 이제는 내가 우리 집에서 게으름의 아이콘 진짜 대명사란 말이여.	3
그러니까 이제는 진짜 우리 집에서 가장 부지런한 사람으로	3
한 번 그 타이틀을 바꿔보고 싶다는 생각을 혀.	3
내가 앞자리가 바뀌는 만큼 타이틀도 바뀔 수 있게 그러면 ((진짜)) 정말 뜻깊을 것 같다는 생각을 하고 있어.	3
그럼 우리 남은 시간 동안 한 번 습관을 바꿔 보고 이제 그 습관이 정착 되도록 한 번 노력을 해 보자구	3
진짜 괜찮을 것 같어.	3
그러니까 우리도 최대한 진짜 이 멋있는 이십 대 ((진짜)) 멋있	3
굳이 너무 강박증 갖지 않아도 되지만 진짜 멋있게	3
이십 대를 보내기 위해서는 지금 얼마 남지 않은 십 대 동안 준비를 해 보자구	3
나는 이제 이십 세 이십 대 때는 뭔가 지금 십 대 때 솔직히 귀찮아서 안 움직이고 막	3
계속 집에서 콕 박혀 있고 그러니까 뭔가	3
난 방학 때 집에만 콕 박혀 있는 게 좋긴 했는데 쫌 우울할 때도 있었거든	3
그러니까 이제 하루에 한 번이라도	3
꼭 나가서 한 시간씩 ((얻고)) 이런 거를 쫌 해 가주구	3
뭐~ 내 정신 건강이라던지 뭔가 삶에 패턴 막 이런 거를 쫌 고치고 싶어.	3
너는 이십 대 때 어떤 걸 하고 싶어?	3
나도 지금 십 대 동안 망쳐 놓은	3
이 생활 리듬이랑 건강을 이십 대 때는 정말 챙겨보고 싶어.	3
왜냐면은 이십 대가 지나면 삼십 대면은 정말 늦을 수두 있기 때문에	3
어~ 눈 건강도 최대한 더 악화시키지 않도록 안경두 블루라이트 차단되는 안경을 쓰고	3
그리고 이제는	3
영양소를 위해서 먹는 ((음식이기라x)) ((임)) 음식이기라기 보다는	3
약도 쫌 챙겨 먹구 영양제도 진짜 많이 (())	3
최대한 건강 관리를 할 수 있게	3
어~ 자그마나치 시간을 내서라도 이십사 시간 중에 삼십 분 시간 내는 거 어려운 거 아니잖아.	3
핸드폰 삼십 분만 안 보면 되는 거고 영화 하나 만 안 봐도 무려 두 시간이나	3
시간을 얻을 수 있기 때문에 오히려 이제는 진짜 건강 관리를 할 때가 된 것 같어.	3
그러니까 이제 이십 대 되면은 어~ 핸드폰 할 시간에 진짜	3
십 분이라도 스트레칭 하는 습관을 길러 ((버스)) 길러 보고자 혀.	3
아~ 우리가 (()) 대간하다면서 안 했던 일도 이제 고치려고 노력하고 있으니까 얼른	3
빨리 그걸 실천할 일이 있었음 좋겠다.	3
나는 머리를 정말 기를려고 생각을 해봤어.	3
그래서 내가 올여름 지나고 머리 묶구 다녔을 때	3
이제 길구 싶어서 머리 묶구 다녀서 길었단 말이야.	3
근데 나는 내 항상 트레이드 마크는 뭐야?	3
지금은 단발이잖아 짧은 단발	3
예전에 내가 옛날 이십 대 때는	3
채시라 머리를 하구 다니는 내 트레이드 마크였는데 이제 나이 들으니까 그게	3
잘 어울리지가 않드라구	3
그 이후부터는 내가 짧은 머리 완전 짧은 머리만 하고 다녔는데	3
난 머리를 풀르구 다니고 싶은 거야 묶는 것보다	3
그래서 음~ 긴 머리를 선호해서 쪼끔 나도 길러보자 해서 했더니	3
울 언니가 나한테 머리 묶구 이릏게 내놓은 거 옥수수수염 같다고 해가지고 내가	3
안 했잖아 그리고 풀르니까 사람들이	3
히익 너무 심난해 보인다는 거야 머리가	3
쫌 어떻게 즘 한번 해보래.	3
그래서 역시나 하서 내가 지금 머리 짤른 거잖아.	3
짤랐는데 어떠냐?	3
너무 잘 어울리구 컬러도 너무 이릏게 잘 매치가	3
내가 이거 염색 요번에	3
올로 다 한 거거든 다했는데 요번에 머리를 깎으러 갔어.	3
솔직히 내가 머리를 이 주 만에 또 깎은 거야 깎았어 깎었는데	3
이거를 어설프게 깎은 거야 마스크를 쓴 채로	3
깎었구 내가 그 언니한테 그랬어.	3
내가 머리는 기른 게 길러 볼라고 했는데	3
다시 깎으러 왔으니까 단발로 깎어주되 세련된 단발로 좀 깎아주세요.	3
이릏게 얘기했어 근데 묶을 수두 좀 있게 해주세요 라고 했는데	3
마스크를 안 벗고 짤라 놓으니까	3
이거보다 좀 더 길게 짤라 놨드라구 근데	3
내가 머리를 하고 다니는 거 매직기로 맨날 하잖아 하니까	3
이 머리가 많이 기른 머리가 돼버린 단발이 돼버린 거야.	3
첫날부터 내 정말 마음에 안 들드라구	3
내 친구한테 물어봐서 어~ 그 선생님이 잘 깎어 해서 했는데 근데 우리 딸은	3
자기는 그냥 엄마 괜찮아 이릏게 얘기를 하는데	3
내가 집에 와서 보니까 막	3
머리카락 하나가 길은 게 있는 거야 그게 빠질라고 한 건가 그르 이릏게 보니까	3
긋두 안 깎어 놓은 거야.	3
뭐~ 우리 딸도 그냥 몇 개 그런 게 좀 있다고 하드라구	3
그리고 머리를 촉촉한 상태에서	3
이릏게 머리 깜고 나서 촉촉한 상태에서 이릏게 깎어야 되는데 그 여자는 머리를 다	3
말린 상태에서 그냥 막 깎드라구	3
그서 저게 뭐가 잘 깎는 거지 라는 생각을 했어 그르다가	3
요번에 내가 정말 도저히 안 되겠어 언니가	3
야 너 저번에 깎었는데 왜 또 깎을라 그래 그래서 언니 나 너무 어중간해.	3
무슨 단발로 깎어 놨는데	3
엄청 많이 길어서 깎을 때가 된 거 같은 그런 느낌의	3
그 지저분함 있잖아 붕한 거	3
그래서 깎으러 가야 돼 이제 생각하다 고민을 했어	3
내가 그전에 선생님한테 깎어야 되나 이 여자한테 한 번 더 한번 해봐?	3
맡겨봐 막 이런 생각을 했어 그르다가	3
아~ 그냥 안 되겠다 싶어서 요번엔 그냥	3
아~ 제가 전화해서	3
제가 어떤 선생님 어떤 선생님한테 양쪽 선생님한테 했는데	3
지금 어떻게 해야 될지 고민이 돼요 그랬더니	3
내가 깎었던 선생님은 지금 일요일이라 휴무라는 거야.	3
그래서 아~ 어머 되게 오랜만이시네요 나한테 그러드라구 그래서	3
머리 많이 길었네 그래서 스앵님 이건 많이 기른 거 아니에요 더 길었었어요.	3
더 길었는데 남들이 옥수수수염 같다고 하고	3
완전히 막 머리가 너무 이상하다 하고 그래서 한 번 깎었어요 선생님	3
제가 음~ 왔는데 선생님 목요일날 휴무잖아요.	3
우리 딸이 딱 그 시간에 된다고 해서 제가 요때 왔는데	3
선생님이 휴무라서 제가 어 딴 선생님한테 깎었어요 그랬더니	3
아~ 근데 누구한테 깎었어요 물어보드라구 그래서	3
아~ 어떤 선생님한테 아~ 그래요 이러드라구	3
그래서 인제 내가 인제 그 선생님한테 깎으면서 선생님 제 머리 스타일 알죠?	3
그랬더니 예 그래서 저 세련된 단발에	3
좀 너무 지금 어중간하다 저 이 주밖에 안 됐는데 머리가 이렇 이래요.	3
그르니까 더 짧게 그리고 더 이릏게	3
음~ 저한테 잘 어울리는 그런 단발 아시죠 그러면서 그걸로 -해- 해달라고 그랬더니	3
알았다고 하드라구 그래서 이제 이릏게 깎었는데	3
처음에 내가 깎고 갔는데 우리 딸이 엄마	3
엄마 엣날 사람 머리 같애 그 보브 스타일 약간 요릏게	3
내가 옆머리를 좀 길게 빼달라고 그랬거든.	3
여기는 짧으면서 약간 이렇게 된 거 있잖아.	3
그래서 그릏게 해줬어 근데 첫날 막	3
드라이로 하고 났을 때는 괜찮았는데 쫌 지나니까	3
또 이 긴 머리 땜에 길어 보이는 느낌이 나는 거야 그래서 내가 오늘 이거 짤른 거야.	3
가위로 여기 잡고 이릏게 짤르고 여기 쪼끔 짤르구	3
그랬어 근데 괜찮지 그냥 짤라도	3
그래서 내 짜르고 근데 그 사람 딱 알아보드라	3
머리 요번에 올로 다했죠 이러드라구 염색 그래서	3
아~ 예 내가 그랬어 그랬더니 아~ 그런 거 같애요 이러드라구 그럼서	3
머리 많이 길었네 또 그 소리를 하는 거야 그래서 선생님	3
저요 똥 머리까지 하고 다녔어요 하도 길어 가지구 그랬더니	3
허 정말요 이러는 거야 그래서	3
아~ 예 -하- 하고서는 내가 인제 속으로 생각했지 그래	3
난 선생님하고 맞는구나 스타일 선생님하고 맞아.	3
이제 이릏게 생각하고 &name1&이한테 야 너는 그 선생님한테 가 나는 이 선생님한테 갈 거야.	3
인제 그릏게 얘기를 했는데 그래서 내가 아~ 머리를 깜으면서	3
요번에 내 얼마나 웃겼는지 아냐 내 머리가 수세미잖아.	3
너무 상해 가지고 탈색을 해 가지구	3
예전에 그 여자 슨생님 할 때는 어머 머리가 너무 많이 상해서	3
단백질제를 해줘야 될 거 같애요.	3
머리가 막 푸석푸석하고 그렇대 그래서	3
저 그거 알아요 그래서 머리도	3
한 번 짤라줄 겸 이게 타고 올라오잖아요 그래서 한 번 짤라줄 겸 제가 그래서	3
음~ 머리도 안 어울리고 해서	3
어~ 역시 나는 단발이 나은 거 같애요 머리 한번 길러볼라고 했더니	3
완전 스타일이 안 나네요 내 그랬어.	3
단발이 어울리세요 이러드라구	3
그래서 이제 그렇게 했는데 그 머리 깜겨주는 요번에	3
그 학생이 나한테 뭐라냐면 나 웃겨 죽는 줄 알았어.	3
어머 머리가 너무 머릿결이 좋으세요.	3
너무 부드러워요 이러는 거야 그래서	3
저요 머릿결 완전히 상했는데요 내 속으로	3
얘가 아직 학생이라 그런지 이걸 잘 모르나?	3
이른 생각이 든 거야.	3
내 머리 완전히 수세미 같은데 지금도 매직기로 해놔서 이렇지.	3
그렇지 않잖아 그래서 내가 아~ 역시 머리는	3
나 예전에 도안동으로 머리 깎으러 갔을 때 삼만팔천 원이잖아 커트가	3
생각해주면서 밥 먹는 거 고려해주구 했더니 끼어 늫기를 해서 막 다 딴 사람 넣었다고 그랬잖아 그래서 내가	3
딱 아~ 너는 엑스 이르카고 내가 안 가는데	3
진짜 여기 여기가 훨씬 나은 거 같애 너두 한번 여기로 바꿔보지 그러냐?	3
어디 미용실이야?	3
아~ 여 &company-name1& 이 층이야.	3
이 층에 어~ &company-name2& &company-name2&	3
어~ 선생님이?	3
&name2& 선생님	3
어~ 커트 값은 얼마 해?	3
이만 원	3
싸네.	3
음~ 그리 근데 거기 가면 있잖아.	3
너무 좋은 게 뭐냐면 우리 신랑도 가면 완전히 이~	3
호텔 바 같 바는 아니지만 호텔에 그~ 앉어 있는 느낌	3
거기에 어~ 차도 물론 너가 지금 다니는데 &company-name3&이잖아 거기는	3
아보카토를 먹을 건지	3
뭐~ 또 물론 음~ 오렌지 쥬스 이런 거는 뭐~ 다 똑같지만 그르구	3
예쁜 접시에 쪼꼼한 그 병에	3
꽃 같은 거 생화 요렇게 꽂은 걸 딱 같이 갖고 와 한 세트로	3
그래서 먹는데	3
거기서 이릏게 앉아 있으면 뭔가 커피숍에 이릏게 호텔 커피숍에 앉아 있는 느낌	3
그리 그 안에 엄청 넓어 시설두 너무 좋고	3
진짜 난 너가 한 번 글루 바꿔봤으면 좋겠어 그리고 주차할 때두 너무 좋아.	3
그 스타벅스 거기를 음~	3
자기가 뭐~ 두 시간 있든 세 시간이든 걔네가 이릏게 찍어주면 되는 거야 그래 차량 남바만 알려주면	3
되는데 음~ 너무 좋아 거기가	3
어~ 그러면 그 디자이너 요일 이름을 찍어	3
내가 지금 머리가 많이 길잖아.	3
지금 못 짤랐어 그니까 선생님하고 같이 미용실을 가기로 했는데	3
일정이 안 맞아서 안 된 거야 그래서	3
내가 지금 가야 되는데 이제는 그 &company-name3& 원장님이 예전처럼	3
그릏게 잘 하지를 않드라구	3
예전에는 내 마음에 쏙 들게 나도 보브 스타일로만 계속 짤르는데	3
너무 몽땅몽땅 잘라 놓은 거야 나는 쪼끔 이릏게 숱이 약간 쳐지면서 이릏게 좀	3
이릏게 슬림하게 내려온 걸 좋아하는데 뭉떵뭉떵 된 거야 그러는데	3
지금 이제 많이 길렀거든.	3
그래서 머리를 한 번 가격도 저렴하고 괜찮은 거 같애 거기가	3
&company-name3&은 얼마야?	3
지금 거기두 이만 원이야.	3
나는 내가 &company-name3&을 너한테 소개를 했지만	3
&company-name3&은 입으로 다하잖아.	3
뭐~ 예전에는 안 그러다가 지금 다시 또 원상태로 돌아간 거야 입으로 하고 있어?	3
많이 쭐어들으긴 했는데	3
예전에는 머리에 집중을 했더라면 지금은 말하느라고 예전 커트가 안 나오는 거야 거기서	3
마음에 들었는데 어~ 얼마 전부터	3
이~ 말이 많아지면서 인제 좀 뭐라 그러지?	3
기교를 많이 늫드라구	3
굳이 머리만 잘 짤르믄 되는데 그래서 아~ 막 요번에는 좀	3
갈 때 너랑 나랑 같이 가자.	3
지금 가야 돼 나는 머리가 너무 많이 길러서	3
원래는 선생님하고 같이 가기로 했는데 선생님이	3
따님이 오시는 바람에 본인이 다니는 미용실이 되게 잘한다 그래서	3
같이 가기루 했는데 이제 선생님 먼저 다녀오신 거지 근데	3
그 미용실은 선생님이 가자고 해서 같이 가기로 한 건데 그렇게 썩 땡기지는 않드라구	3
그래서 지금 미용실을 쫌 고민하고 있었었거든.	3
오늘 내가 잘 얘기했네.	3
거기는 아무튼 선생님도 많아서	3
나중에 난 원래 따른 선생님한테 했었는데 그 선생님 그만두면서 내가 인제 이 선생님 어~	3
커트 어떤 선생님이 잘해요 이래 물어봤지 그랬더니 이 선생님을 소개를 하드라구	3
근데 나는 내 친구가 소개해서 거기를 가게 됐는데 음~ 마음에 드는 거 같애 가격도	3
